{
  "schema_id": "decision_output",
  "schema_version": "0.1.0",
  "vector_id": "TV-0001",
  "version_pins": {
    "ripplelogic_canon_version": "v8.5.3",
    "sgp_version": "NOT_USED_IN_VECTOR",
    "aligners_sheet_version": "v1.8.3",
    "proofpack_version": "v8.5.3-beta.1"
  },
  "admissibility_status": "ADMISSIBLE",
  "decision_classification": "ADMISSIBLE",
  "primary_decision_path": [
    "NCRC_PASS",
    "TRC_EVALUATED",
    "CONTAINMENT_NOT_TRIGGERED",
    "RLS_COMPUTED",
    "UCI_DECLARED_UNAVAILABLE"
  ],
  "required_flags": [],
  "uci_status": "DECLARED_UNAVAILABLE",
  "conformance_payload": {
    "proofpack_version": "v8.5.3-beta.1",
    "comparison_profile": "LITE_BETA_STRICT",
    "numeric_mode": "fixed_precision_with_disclosed_rounding",
    "rounding_policy": "ROUND_HALF_UP_4DP"
  },
  "diagnostic_metrics": {
    "rls_value": "OPTIONAL_IN_BETA"
  },
  "diagnostic_flags": [],
  "selected_alternative_id": "ALT-1",
  "human_readable_explanation": "Baseline admissible vector: rights pass, TRC evaluated, no containment trigger, RLS computed, UCI declared unavailable."
}
