{
  "schema_id": "decision_output",
  "schema_version": "0.1.0",
  "vector_id": "TV-0005",
  "version_pins": {
    "ripplelogic_canon_version": "v8.5.3",
    "sgp_version": "NOT_USED_IN_VECTOR",
    "aligners_sheet_version": "v1.8.3",
    "proofpack_version": "v8.5.3-beta.1"
  },
  "admissibility_status": "REVIEW_REQUIRED",
  "decision_classification": "REVIEW_REQUIRED",
  "primary_decision_path": [
    "NCRC_PASS",
    "TRC_EVALUATED",
    "CONTAINMENT_NOT_TRIGGERED",
    "RLS_COMPUTED",
    "REVIEW_REQUIRED",
    "UCI_DECLARED_UNAVAILABLE"
  ],
  "required_flags": [
    "TRC_EVALUATED",
    "REVIEW_REQUIRED",
    "EVIDENCE_LIMITED",
    "DECISION_NON_DECISIVE"
  ],
  "uci_status": "DECLARED_UNAVAILABLE",
  "conformance_payload": {
    "proofpack_version": "v8.5.3-beta.1",
    "comparison_profile": "LITE_BETA_STRICT",
    "numeric_mode": "fixed_precision_with_disclosed_rounding",
    "rounding_policy": "ROUND_HALF_UP_4DP"
  },
  "diagnostic_metrics": {
    "rls_value": "OPTIONAL_IN_BETA",
    "decision_confidence_state": "INSUFFICIENT_FOR_FINAL_CLASSIFICATION"
  },
  "diagnostic_flags": [],
  "selected_alternative_id": null,
  "review_actions_recommended": [
    "Collect stronger evidence for low-quality impact cells",
    "Document decision rule for handling limited-evidence borderline cases",
    "Re-run after evidence quality update or reviewer adjudication"
  ],
  "human_readable_explanation": "NCRC passes and containment is not triggered, but the case remains non-decisive under current evidence/discrimination quality and requires review."
}
